{
  "schema": "ferris.command-result/v2",
  "command_version": "0.1.0",
  "semantic_command_id": "doctor",
  "selection_identity": "selection:1111111111111111111111111111111111111111111111111111111111111111",
  "invocation_identity": "invocation:2222222222222222222222222222222222222222222222222222222222222222",
  "result_identity": "result:5ad965994b7582a59ba999aabfcf99586f2bfed231d3b30b0f74d1a517b55e15",
  "result_class": "blocked",
  "process_exit_code": 7,
  "diagnostics": [
    {
      "code": "FERRIS-READINESS-BLOCKED",
      "severity": "error",
      "result_class": "blocked",
      "message": "A required readiness observation is blocking.",
      "source_digest": null,
      "next_actions": [
        "Review the typed readiness report."
      ]
    }
  ],
  "record": {
    "schema": "ferris.environment-readiness-report/v1",
    "report_id": "report:7255e394c16d174ea565773265505dbb663875901f2bb72b905f19e10ff87b68",
    "requirements_digest": "sha256:eee3610d170845f2be8c847646bb5c3f889e0a170b27d64b303552d0ad465d2e",
    "workspace_id": "ferris.fixture/readiness",
    "observed_platform": {
      "operating_system": "windows",
      "architecture": "x86_64"
    },
    "aggregate_status": "blocked",
    "observations": [
      {
        "requirement_id": "advisory-pwsh",
        "kind": "executable",
        "criticality": "advisory",
        "status": "satisfied",
        "diagnostic_code": "FERRIS-READINESS-EXECUTABLE-SATISFIED",
        "evidence": {
          "observation_method": "process_path_resolution",
          "value_retained": false,
          "resolved_path_retained": false,
          "content_retained": false
        }
      },
      {
        "requirement_id": "env-path",
        "kind": "environment",
        "criticality": "required",
        "status": "satisfied",
        "diagnostic_code": "FERRIS-READINESS-ENVIRONMENT-SATISFIED",
        "evidence": {
          "observation_method": "environment_name_presence",
          "value_retained": false,
          "resolved_path_retained": false,
          "content_retained": false
        }
      },
      {
        "requirement_id": "env-pathext",
        "kind": "environment",
        "criticality": "required",
        "status": "satisfied",
        "diagnostic_code": "FERRIS-READINESS-ENVIRONMENT-SATISFIED",
        "evidence": {
          "observation_method": "environment_name_presence",
          "value_retained": false,
          "resolved_path_retained": false,
          "content_retained": false
        }
      },
      {
        "requirement_id": "executable-cargo",
        "kind": "executable",
        "criticality": "required",
        "status": "missing",
        "diagnostic_code": "FERRIS-READINESS-EXECUTABLE-MISSING",
        "evidence": {
          "observation_method": "process_path_resolution",
          "value_retained": false,
          "resolved_path_retained": false,
          "content_retained": false
        }
      },
      {
        "requirement_id": "path-cargo-manifest",
        "kind": "path",
        "criticality": "required",
        "status": "satisfied",
        "diagnostic_code": "FERRIS-READINESS-PATH-SATISFIED",
        "evidence": {
          "observation_method": "repository_path_metadata",
          "value_retained": false,
          "resolved_path_retained": false,
          "content_retained": false
        }
      },
      {
        "requirement_id": "platform-supported",
        "kind": "platform",
        "criticality": "required",
        "status": "satisfied",
        "diagnostic_code": "FERRIS-READINESS-PLATFORM-SATISFIED",
        "evidence": {
          "observation_method": "current_platform",
          "value_retained": false,
          "resolved_path_retained": false,
          "content_retained": false
        }
      }
    ],
    "source_dispositions": [
      {
        "source_id": "doc-source",
        "disposition": "declared_only"
      },
      {
        "source_id": "owner-source",
        "disposition": "declared_only"
      }
    ],
    "unknowns": [],
    "limitations": [
      "FERRIS-READINESS-PRESENCE-DOES-NOT-PROVE-OWNER-SUCCESS"
    ]
  }
}
